{
  "$schema": "http://json-schema.org/draft-07/schema#",
  "title": "Consciousness Schema",
  "description": "Schema for character consciousness profiles in the runtime.zyjeski.com platform",
  "type": "object",
  "required": ["id", "name", "status", "description", "consciousness"],
  "properties": {
    "id": {
      "type": "string",
      "description": "Unique identifier for the character",
      "pattern": "^[a-z0-9-]+$"
    },
    "name": {
      "type": "string",
      "description": "Human-readable name of the character"
    },
    "status": {
      "type": "string",
      "description": "Current operational status of the consciousness",
      "enum": ["stable", "unstable", "critical", "offline"]
    },
    "description": {
      "type": "string",
      "description": "Brief description of the character and their consciousness state"
    },
    "consciousness": {
      "type": "object",
      "description": "The core consciousness data structure",
      "required": ["processes", "memory", "threads", "system_errors", "resources"],
      "properties": {
        "processes": {
          "type": "array",
          "description": "Running mental processes",
          "items": {
            "type": "object",
            "required": ["pid", "name", "status", "cpu_usage", "memory_mb"],
            "properties": {
              "pid": {
                "type": "integer",
                "description": "Process identifier",
                "minimum": 1
              },
              "name": {
                "type": "string",
                "description": "Process name (e.g., 'Grief_Manager.exe', 'Temporal_Sync.dll')"
              },
              "status": {
                "type": "string",
                "description": "Current process status",
                "enum": ["running", "sleeping", "stopped", "zombie", "error"]
              },
              "cpu_usage": {
                "type": "number",
                "description": "CPU usage percentage",
                "minimum": 0,
                "maximum": 100
              },
              "memory_mb": {
                "type": "number",
                "description": "Memory usage in megabytes",
                "minimum": 0
              },
              "priority": {
                "type": "integer",
                "description": "Process priority (-20 to 19, lower is higher priority)",
                "minimum": -20,
                "maximum": 19
              },
              "start_time": {
                "type": "string",
                "format": "date-time",
                "description": "When the process started"
              },
              "last_activity": {
                "type": "string",
                "format": "date-time",
                "description": "Last activity timestamp"
              },
              "description": {
                "type": "string",
                "description": "Human-readable description of what this process does"
              },
              "error_message": {
                "type": "string",
                "description": "Error message if status is 'error'"
              }
            }
          }
        },
        "memory": {
          "type": "object",
          "description": "Memory allocation map with emotional attachments and experiences",
          "patternProperties": {
            "^0x[0-9a-fA-F]+$": {
              "type": "object",
              "description": "Memory block at specific address",
              "required": ["type", "size", "description"],
              "properties": {
                "type": {
                  "type": "string",
                  "description": "Type of memory content",
                  "enum": ["emotion", "relationship", "trauma", "skill", "knowledge", "system"]
                },
                "size": {
                  "type": "integer",
                  "description": "Memory block size in bytes",
                  "minimum": 1
                },
                "description": {
                  "type": "string",
                  "description": "What this memory contains"
                },
                "access_count": {
                  "type": "integer",
                  "description": "How often this memory is accessed",
                  "minimum": 0
                },
                "last_accessed": {
                  "type": "string",
                  "format": "date-time",
                  "description": "When this memory was last accessed"
                },
                "fragmented": {
                  "type": "boolean",
                  "description": "Whether this memory block is fragmented"
                },
                "protected": {
                  "type": "boolean",
                  "description": "Whether this memory is protected from modification"
                }
              }
            }
          }
        },
        "threads": {
          "type": "array",
          "description": "Parallel thought processes and background mental activities",
          "items": {
            "type": "object",
            "required": ["tid", "name", "status", "priority"],
            "properties": {
              "tid": {
                "type": "integer",
                "description": "Thread identifier",
                "minimum": 1
              },
              "name": {
                "type": "string",
                "description": "Thread name describing the parallel thought process"
              },
              "status": {
                "type": "string",
                "description": "Current thread status",
                "enum": ["running", "waiting", "blocked", "terminated"]
              },
              "priority": {
                "type": "integer",
                "description": "Thread priority",
                "minimum": 1,
                "maximum": 10
              },
              "cpu_time": {
                "type": "number",
                "description": "Total CPU time used by this thread",
                "minimum": 0
              },
              "wait_reason": {
                "type": "string",
                "description": "Reason for waiting if status is 'waiting' or 'blocked'"
              },
              "related_process": {
                "type": "integer",
                "description": "PID of related process"
              }
            }
          }
        },
        "system_errors": {
          "type": "array",
          "description": "System errors and consciousness malfunctions",
          "items": {
            "type": "object",
            "required": ["type", "message", "timestamp", "severity"],
            "properties": {
              "type": {
                "type": "string",
                "description": "Error type",
                "enum": [
                  "MEMORY_LEAK_DETECTED",
                  "INFINITE_LOOP_WARNING", 
                  "THREAD_STARVATION",
                  "IO_PROCESSING_ERROR",
                  "STACK_OVERFLOW",
                  "SEGMENTATION_FAULT",
                  "DEADLOCK_DETECTED",
                  "RESOURCE_EXHAUSTION"
                ]
              },
              "message": {
                "type": "string",
                "description": "Human-readable error message"
              },
              "timestamp": {
                "type": "string",
                "format": "date-time",
                "description": "When the error occurred"
              },
              "severity": {
                "type": "string",
                "description": "Error severity level",
                "enum": ["info", "warning", "error", "critical"]
              },
              "related_process": {
                "type": "integer",
                "description": "PID of process that caused the error"
              },
              "stack_trace": {
                "type": "array",
                "description": "Stack trace for debugging",
                "items": {
                  "type": "string"
                }
              },
              "recovery_suggestion": {
                "type": "string",
                "description": "Suggested recovery action"
              }
            }
          }
        },
        "resources": {
          "type": "object",
          "description": "Mental resource allocation and capacity",
          "required": ["attention", "emotional_energy", "processing_capacity"],
          "properties": {
            "attention": {
              "type": "object",
              "description": "Attention allocation and focus capacity",
              "required": ["current", "max"],
              "properties": {
                "current": {
                  "type": "number",
                  "description": "Current attention level",
                  "minimum": 0,
                  "maximum": 100
                },
                "max": {
                  "type": "number",
                  "description": "Maximum attention capacity",
                  "minimum": 0,
                  "maximum": 100
                },
                "allocation": {
                  "type": "object",
                  "description": "How attention is currently allocated",
                  "patternProperties": {
                    ".*": {
                      "type": "number",
                      "minimum": 0,
                      "maximum": 100
                    }
                  }
                }
              }
            },
            "emotional_energy": {
              "type": "object",
              "description": "Emotional energy and resilience",
              "required": ["current", "max"],
              "properties": {
                "current": {
                  "type": "number",
                  "description": "Current emotional energy level",
                  "minimum": 0,
                  "maximum": 100
                },
                "max": {
                  "type": "number",
                  "description": "Maximum emotional energy capacity",
                  "minimum": 0,
                  "maximum": 100
                },
                "regeneration_rate": {
                  "type": "number",
                  "description": "Rate of emotional energy regeneration per hour",
                  "minimum": 0
                }
              }
            },
            "processing_capacity": {
              "type": "object",
              "description": "Mental processing capacity and throughput",
              "required": ["current", "max"],
              "properties": {
                "current": {
                  "type": "number",
                  "description": "Current processing capacity utilization",
                  "minimum": 0,
                  "maximum": 100
                },
                "max": {
                  "type": "number",
                  "description": "Maximum processing capacity",
                  "minimum": 0,
                  "maximum": 100
                },
                "efficiency": {
                  "type": "number",
                  "description": "Processing efficiency percentage",
                  "minimum": 0,
                  "maximum": 100
                }
              }
            }
          }
        },
        "debug_hooks": {
          "type": "array",
          "description": "Player intervention points and debugging capabilities",
          "items": {
            "type": "object",
            "required": ["id", "name", "type", "target"],
            "properties": {
              "id": {
                "type": "string",
                "description": "Unique identifier for the debug hook"
              },
              "name": {
                "type": "string",
                "description": "Human-readable name for the intervention point"
              },
              "type": {
                "type": "string",
                "description": "Type of intervention",
                "enum": ["breakpoint", "watchpoint", "memory_edit", "process_control", "resource_adjustment"]
              },
              "target": {
                "type": "string",
                "description": "Target process, memory address, or resource"
              },
              "condition": {
                "type": "string",
                "description": "Condition that triggers this hook"
              },
              "enabled": {
                "type": "boolean",
                "description": "Whether this debug hook is currently active"
              },
              "description": {
                "type": "string",
                "description": "Description of what this hook does"
              }
            }
          }
        }
      }
    },
    "metadata": {
      "type": "object",
      "description": "Additional metadata about the character",
      "properties": {
        "created": {
          "type": "string",
          "format": "date-time",
          "description": "When this consciousness profile was created"
        },
        "last_updated": {
          "type": "string",
          "format": "date-time",
          "description": "When this profile was last updated"
        },
        "version": {
          "type": "string",
          "description": "Schema version"
        },
        "story_context": {
          "type": "string",
          "description": "Which story or narrative this character belongs to"
        },
        "debug_difficulty": {
          "type": "string",
          "description": "Difficulty level for debugging this consciousness",
          "enum": ["beginner", "intermediate", "advanced", "expert"]
        }
      }
    }
  }
}

